Published,Headline
2019-01-15T13:43:52+0000,"Ren Zhengfei, C.E.O. of the Chinese tech giant, said he would wait to see if President Trump intervened in the case of his daughter, who is accused of fraud."
2019-01-26T15:52:24+0000,"A government campaign against unofficial construction in Pakistan’s largest city is leaving hundreds of hawkers without a livelihood, but the Empress Market walls are visible from the sidewalk."
2019-01-14T06:00:10+0000,The California watchmaker creates affordable mechanical timepieces for the fashion customer.
2019-01-02T07:00:00+0000,This word has appeared in 10 articles on NYTimes.com in the past year.
2019-01-13T05:30:01+0000,All of the weddings right here on one handy page for you.
2019-02-01T23:45:25+0000,A former chairman of the Joint Chiefs of Staff doles out lessons in restraint for a hot-tempered commander in chief.
2019-02-17T05:30:00+0000,All of the weddings right here on one handy page for you.
2019-02-07T19:03:17+0000,"As the cases inch toward trial, the conspiracy theorist faces the possibility that he will have to be deposed and provide business records."
2019-02-08T17:47:06+0000,"Married with three children, she became a vigorous advocate after her wife died. Her name is on a new New Jersey law on gender identity."
2019-02-07T08:00:01+0000,"For 50 years, a Long Island suburb has paid its main local newspaper to run weekly public notices, but is now diverting them after the paper’s tough coverage."
2019-01-19T10:00:10+0000,"Across the country, pawnbrokers report they are seeing a steady trickle of federal employees, many of them first-time customers, looking for short-term loans."
2019-02-13T09:00:05+0000,"With few colleagues of color in the four big agencies, these representatives have an impact on what is produced. But they also face isolation and other barriers."
2019-02-28T01:24:04+0000,"Members of a more centrist coalition of Democrats say that instead of single-payer health care, Congress should initially focus instead on shoring up the Affordable Care Act."
2019-01-26T02:31:09+0000,"Corrections appearing in print on Saturday, January 26, 2019."
2019-02-14T23:23:13+0000,"Our TV critic Margaret Lyons has three great suggestions for the long weekend, depending on your time and mood."
2019-02-27T20:40:43+0000,"Chicago will pick a replacement for Mayor Rahm Emanuel on Tuesday. Regardless of who wins, the city’s political ecosystem has been transformed."
2019-02-27T16:50:55+0000,The impressionistic family comedy on FX captures the labor of love better than ever in its third season.
2019-02-25T04:52:02+0000,"Close, nominated seven times, was the favorite for the best actress trophy. Olivia Colman won instead."
2019-01-03T10:00:01+0000,"Trade wars, visa restrictions and anti-immigrant sentiments make it harder for the U.S. to school the world."
2019-02-26T10:00:07+0000,I set out to understand how a group of real estate professionals allegedly used Airbnb to convert apartments into illegal hotel rooms.
2019-02-24T03:10:04+0000,"The rebuilding Rangers received two conditional selections for the Norwegian, who became a fan favorite in New York."
2019-02-17T15:55:29+0000,"At the league’s annual showcase, players should bring their sneakers — as long as they match their ties. It’s all about parties during All-Star weekend."
2019-02-05T22:37:48+0000,The city’s health department said it was ordering restaurants to stop selling food products containing the increasingly trendy cannabidiol.
2019-02-26T16:11:39+0000,"With a designated #WeddingHashtag, guests can post photos on Facebook, Instagram, Twitter and other social media, serving as personal paparazzi."
2019-01-16T20:30:37+0000,"The Supreme Court considered whether the 21st Amendment, which ended Prohibition, gave states power to discriminate against some liquor store owners."
2019-01-15T16:50:39+0000,"The former PepsiCo chief executive has been courted by Ivanka Trump, who is helping lead the search for a new World Bank president."
2019-02-05T10:00:01+0000,"Every January, thousands of agricultural families come together for a 16-day celebration of Western heritage."
2019-02-16T06:01:16+0000,"But the one-time wunderkind turned éminence grise is eager to look forward, not back."
2019-01-11T10:42:19+0000,"A Polish citizen who works for the French telecommunications company Orange was also charged, officials said."
2019-01-19T00:22:56+0000,"The federal shutdown has brought a particular chill to Kodiak, a small town of 6,300 on an isolated island in the Gulf of Alaska."
2019-02-22T04:17:23+0000,"The lawsuit claims that by introducing entertainment like musical performances and theater, the Public hotel on the Lower East Side is sowing confusion."
2019-01-18T01:26:42+0000,"The Justice Department investigation stemmed from work that the law firm Skadden Arps did with Paul Manafort, President Trump’s former campaign chairman."
2019-01-01T10:00:06+0000,Changing your approach to traveling can go a long way in making you happier and healthier in the New Year. Here are three ways to get the most out of your trips in 2019.
2019-02-25T18:23:48+0000,"Yardbird, in Hong Kong, mixes the polish of Tokyo’s favorite restaurants, the warmth of Sydney’s and the glamour of New York’s, with results that draw chefs from all over the globe."
2019-02-01T07:08:34+0000,The jobs situation may be even worse than was suspected.
2019-01-30T15:52:47+0000,"The social network has disclosed an estimate for years, but a closer look raises lots of questions."
2019-01-13T00:05:52+0000,"Amid concerns that the Trump administration is going easy on Russia, Senator Chuck Schumer plans a Senate vote to protect sanctions against the companies of Oleg V. Deripaska."
2019-02-17T05:00:00+0000,They started out as workout buddies at a gym near their offices.
2019-01-08T22:50:13+0000,"For many Americans, this film will be an introduction to the actress and director Genevieve Nnaji, one of the Nigerian movie industry’s biggest stars."
2019-02-12T11:00:04+0000,Food shortages and an unrelenting surge in prices are overwhelming Venezuelans. They could prove to be the force that spurs Maduro’s exit from power.
2019-01-17T02:05:04+0000,"The move is the most ambitious effort yet by a tech company to fund construction for local teachers, firefighters and other middle- and low-income residents."
2019-01-30T23:25:12+0000,Votes in Parliament have put Britain on a collision course with the European Union over Brexit. Critics say lawmakers failed to take control.
2019-01-29T21:30:03+0000,"The iPhone maker, which reported quarterly earnings, faces a number of issues, from consumer demand in China to an unusual security bug in its iPhone software."
2019-02-15T19:01:31+0000,"Benjamin Dreyer talks about his best-selling guide to writing, and Thomas Mallon discusses “Landfall,” his new novel about the presidential administration of George W. Bush."
2019-01-29T22:11:38+0000,The Brazilian president’s pro-business agenda will be a test of American companies’ commitment to the environment.
2019-02-22T02:01:56+0000,"Some governments detain reporters, others demonize them. This week’s Australia Letter examines the impact."
2019-01-17T16:12:09+0000,"This week, Atelier Vime unveils its new showroom and a collaboration with the American artist Wayne Pate."
2019-01-23T23:18:04+0000,"The small Manhattan theater unveiled the 2019 class of the Joe’s Pub Working Group, which supports rising artists in New York."
2019-02-12T11:00:07+0000,"Technology engineers have long served big profitable businesses well, while apps focusing on what more altruistic organizations need remained sparse. But that’s changing."
2019-02-06T19:23:40+0000,"Small-scale protests underscore the challenges that the slowdown poses to China’s top leader, who has aggressively promoted the “Chinese dream” of greater wealth and a fairer society."
2019-02-18T00:28:44+0000,"Yes, Amazon’s departure will modestly hurt the city’s economy. But it’s also a victory against bad economic policy."
2019-01-23T14:27:51+0000,"Hopes that Emmerson Mnangagwa would govern with a lighter hand than his predecessor, Robert Mugabe, have been dashed by a crackdown on demonstrations."
2019-02-20T00:32:49+0000,Fractures are growing among both Democrats and Republicans.
2019-02-14T11:00:10+0000,Tehran’s behavior gives the lie to the idea that it matches conciliation with conciliation. It matches conciliation with contempt.
2019-01-13T05:10:01+0000,The couple met in 2013 through a mutual friend on the campus of Stanford.
2019-01-23T21:16:32+0000,"Mr. Benes helped engineer the release of 3,600 political prisoners from Cuba, but he earned the wrath of fellow exiles in Miami."
2019-01-15T19:31:11+0000,"Season 5 of the pleasant, zany sitcom continues to showcase the show’s biggest asset: Its heart."
2019-02-19T08:00:05+0000,Advocates of charging a fee to enter congested areas of Manhattan say the odds have significantly improved in Albany. Here’s why.
2019-01-03T18:17:29+0000,Street kiosks challenged by ubiquity of internet.
2019-02-12T17:39:42+0000,Millions of people are expected to submit their returns via mobile platforms this year. I won’t be one of them.
2019-01-08T18:09:46+0000,Away from the Instagram glare of the self-conscious influencers that descend on the huge Pitti Uomo trade fair are bread-and-butter labels like L.B.M. 1911 that deliver the goods.
2019-02-13T12:18:15+0000,Train travel was also upended and schools were closed as a national strike threatened to bring the country to a standstill on Wednesday.
2019-02-12T17:28:22+0000,The British leader says she needs more time to negotiate with the European Union. But critics say she is running down the clock to pressure Parliament.
2019-01-08T17:16:14+0000,"Bang Bar, a new food stall from David Chang, brings the traditions of shawarma, doner kebab and tacos al pastor to the Time Warner Center."
2019-01-29T02:41:06+0000,"Corrections appearing in print on Tuesday, January 29, 2019."
2019-02-15T10:46:29+0000,Here’s what you need to know.
2019-01-24T00:06:49+0000,"No one, particularly ordinary Cubans, is benefiting from the 60-year feud."
2019-01-04T23:18:41+0000,Commissioner Scott Gottlieb says the terms of the new partnership between the two companies appear to undermine pledges they made to keep flavored nicotine pods off store shelves.
2019-02-17T05:10:00+0000,"After he texted several clues to her, she joined him for their first date on the rooftop of a new chemistry building on campus."
2019-01-21T16:25:47+0000,France penalized the company for not properly disclosing to users how data is collected across its services to present personalized advertising.
2019-02-06T14:00:06+0000,"The company acquired The Works Entertainment, the makers of the Illusionists magic franchise and other shows."
2019-01-30T21:39:57+0000,Their shop is the thinking person’s place to go after hitting the jackpot in Las Vegas (or New York).
2019-01-25T10:00:00+0000,"A whole sprawling history of the United States, packed into one line of poetry."
2019-02-28T00:11:27+0000,"On national TV, President Trump’s old attack dog faced off against his new ones."
2019-02-26T10:00:06+0000,"Manhattan district attorney Cyrus R. Vance Jr., is building a case against President Trump’s former campaign chairman. But it won’t necessarily be easy."
2019-01-25T02:40:38+0000,"Corrections appearing in print on Friday, January 25, 2019."
2019-01-13T19:14:25+0000,"The tribute makes Elliott only the third rapper to be inducted into the organization, following Jay-Z and Jermaine Dupri."
2019-02-04T17:29:41+0000,"Most albums that dominate Billboard’s Top 200 reach the top with million of streams. The boy band’s latest LP, bundled with concert tickets, opened at the top thanks to sales."
2019-01-17T02:02:11+0000,"The inquiry grew out of a 2014 civil suit and appears unrelated to other pressure faced by the Chinese company, two people familiar with the case said."
2019-02-12T05:05:25+0000,Let us help you start your day.
2019-02-02T03:49:01+0000,"Corrections appearing in print on Saturday, February 2, 2019."
2019-02-05T10:27:01+0000,A night bazaar featuring Krispy Kreme doughnuts will be held steps from where a Burmese independence hero was assassinated in 1947.
2019-02-11T17:45:05+0000,"The rapper’s album “Hoodie SZN” has now spent three weeks atop the Billboard chart, and broke its own record for lowest sales by a No. 1 album."
2019-01-14T23:24:20+0000,Nobody left besides those with no reputation to lose.
2019-02-20T10:00:10+0000,"With a $300 million investment and upgraded amenities, the New Mexico ski area was attempting a revival without losing its soul. A fatal avalanche tested that effort even further."
2019-01-14T17:02:14+0000,"Faced with slowing sales growth, some brewers are looking to reach a new, more diverse audience."
2019-02-21T16:43:27+0000,"Brian Posada was born in Las Vegas, but grew up in Mexico. Read his story in Crossing the Border, our new limited-run newsletter."
2019-01-12T01:30:05+0000,"The hiring of Stefan Passantino, a deputy counsel who was in charge of ethics policy, is part of the strategy by the White House and the company to counter an expected onslaught from House Democrats."
2019-03-01T03:31:24+0000,"Corrections appearing in print on Friday, March 1, 2019."
2019-02-19T16:19:55+0000,"At London Fashion Week, Brexit was the refrain for Burberry’s contrasts, Victoria Beckham’s lifestyle and Molly Goddard’s yards of tulle."
2019-01-15T10:00:05+0000,"For one of the tallest players in tennis, regularly flying around the world to play tournaments can be a challenge."
2019-02-21T02:32:24+0000,"The hearing before Congress will give Mr. Cohen, once one of President Trump’s most loyal aides, a rare public platform to explain his work for the president."
2019-01-04T11:00:01+0000,"Three couples share their stories after marrying on a December day at the Manhattan Marriage Bureau, where the brides also rented their flowers."
2019-02-02T12:00:00+0000,"Race/Related is a weekly newsletter focused on race, society and identity, with provocative stories from around The New York Times."
2019-02-01T06:37:48+0000,"President Trump spoke with The New York Times on Thursday, sitting down with two White House correspondents, Peter Baker and Maggie Haberman, and A.G. Sulzberger, the newspaper’s publisher."
2019-02-26T20:45:07+0000,Two readers disagree with an Op-Ed writer’s belief that counting women is the wrong approach.
2019-01-09T22:12:43+0000,A warm vibe between Kevin Hart and Bryan Cranston sweetens the stereotypes in this remake of the French odd-couple comedy “The Intouchables.”
2019-02-01T11:00:05+0000,"One common thread of J.D. Vance’s and Tara Westover’s memoirs is distrust of institutions. Yet it was institutions — the military in one case, college in the other — that saved them."
2019-01-23T10:00:12+0000,"Many in Calexico, Calif., were offended when President Trump called improvements to the border fence there “the start of our Southern Border WALL!”"
2019-02-01T00:15:59+0000,"The administration’s plan to shift commercial gun export regulations from the State Department to the Commerce Department should boost overseas sales, but Democrats are worried."
2019-01-22T10:00:10+0000,"As the Chinese telecommunications giant faces scrutiny over its security, its careful cultivation of European governments and customers is at risk of unraveling."
2019-01-30T21:56:46+0000,"Under pressure from small merchants, the Indian government is prohibiting Amazon and Walmart from selling products on their own sites."
2019-01-22T04:21:29+0000,Let us help you start your day. 
2019-01-10T22:37:20+0000,Does contaminated food smell like freedom?
2019-01-08T10:00:01+0000,"As treatment with aligners moves from the adult to the younger market, orthodontists are treating more children without traditional wire braces."
2019-02-22T10:00:08+0000,"In her memoir “Stet,” the editor behind writers such as V.S. Naipaul and Jean Rhys reflected on her life in publishing."
2019-02-01T11:00:05+0000,"Desperate people can make $30 donating plasma, up to 104 times a year, in this $20 billion industry."
2019-02-22T18:59:01+0000,"In Karachi, five children from one family died of food poisoning on Friday, the latest of several incidents causing an outcry over lax enforcement of safety laws."
2019-02-13T18:00:07+0000,"In a country where wealth usually comes from mining or banking, Scott Farquhar and Mike Cannon-Brookes of Atlassian are a new kind of mogul. And they’re getting into politics."
2019-01-08T17:20:56+0000,"Britain is trying to prove both that leaving the E.U. would be disastrous and that it has the situation under control, and it seems to be failing either way."
2019-01-07T14:21:42+0000,"Forget black. As awards season began, it was back to business. And then there was Timothée Chalamet. "
2019-02-14T10:00:14+0000,"The city’s Arts District offers theater without blue men or topless women, no poker tables, and the kind of indie food and bar scene not often seen on the Strip."
2019-02-01T04:25:46+0000,Let us help you start your day.
2019-01-13T03:15:43+0000,"Corrections appearing in print on Sunday, January 13, 2019."
2019-01-01T07:30:05+0000,Underperforming media deals have left the conference falling behind its peers off the field. That might be the root of its problems on it.
2019-01-05T02:15:31+0000,With apologies to the People’s Front of Judea.
2019-01-05T01:59:16+0000,The Israeli author will be spared the littleness of Israeli and Palestinian leaders.
2019-01-25T15:22:15+0000,"While the I.R.S. has said it expects refunds to be issued on schedule, the agency is going to take a while to return to normal after the government shutdown."
2019-02-10T19:55:28+0000,He made countless commercials; at one point it was said that people who listened to the radio or watched TV heard his voice every single day.
2019-01-10T02:08:06+0000,"Corrections appearing in print on Thursday, January 10, 2019."
2019-02-08T08:50:17+0000,"West Africa’s new art destination is a sprawling megacity with a generation of artists, gallerists and collectors powering the scene."
2019-01-14T11:12:16+0000,"The mayor proposed a tax on landlords will help, but a state legislator wants to survey the problem first, a legislator said. Also, a no-pants party on the subway."
2019-01-02T20:00:03+0000,"Only Washington and Beijing, working together, can slow climate change and the spread of nuclear weapons."
2019-01-14T18:16:42+0000,"In the absence of intense international pressure or a public uprising, neither of which seems imminent, the outgoing president may be outgoing in name only."
2019-02-27T23:51:40+0000,"In Michael D. Cohen, the Capitol welcomed a star witness to meet the moment — a hangdog avatar of New York hucksterism, delivered to revisit the questions that have defined the Trump presidency."
2019-01-22T01:33:43+0000,To see this president lose to a woman would start to heal the injury of his repulsive reign.
2019-02-08T19:33:32+0000,"Normally the web is a haven for the dark side. This time, the Amazon chief executive used it to let in the light."
2019-02-28T01:53:14+0000,Democrats will face a chorus from the party’s liberals to impeach President Trump. Republicans will have to decide how much to support him.
2019-01-08T05:29:18+0000,"Corrections appearing in print on Tuesday, January 8, 2019."
2019-02-16T15:00:04+0000,"Many landlords do not readily offer leases to subletters, but there are laws to ensure that primary tenants don’t game the system."
2019-02-15T10:00:05+0000,Our reviewer called the 1999 book “a puzzling exercise.”
2019-01-25T08:55:40+0000,Lessons from the Jim Crow-era travel guide for African-American elites.
2019-02-08T22:21:38+0000,Todd Snyder and Emily Bode make a strong case for American fashion.
2019-01-25T14:00:04+0000,Facebook’s chief executive has asserted control over its sprawling divisions and mandated the social network’s messaging services be knitted together.
2019-01-18T16:20:44+0000,The president keeps finding ways to spoil a good thing.
2019-01-15T14:00:04+0000,Recent commercial real estate transactions in New York City.
2019-02-12T18:35:52+0000,"A selection of books published this week; plus, a peek at what our colleagues around the newsroom are reading."
2019-01-17T01:01:59+0000,"Alex Cifuentes Villa, El Chapo’s former assistant, would end up accusing a Mexican president of taking bribes at his former boss’s drug trial."
2019-01-16T20:05:36+0000,"The governor of California has proposed some big ideas. Who knows whether he can pull them off, but there’s reason for hope. "
2019-02-01T17:01:55+0000,"The obituary, published on Nov. 27, 1883, described Truth as a famous lecturer on “temperance, politics, and the woman’s rights question.”"
2019-01-16T11:00:05+0000,"Finally, the Legislature gets to work."
2019-02-27T00:29:13+0000,"Robert Lighthizer, the United States trade representative, must defend a trade pact that is shaping up to be less ambitious than he might once have hoped."
2019-02-21T17:53:32+0000,"The new attorney general, William Barr, is preparing to receive a report on the special counsel’s investigation. He will then have to decide how much of it to make public."
2019-02-25T13:31:41+0000,How to understand his report. Also: The debate over the upper middle class.
2019-01-03T09:00:09+0000,"Going around the traditional gatekeepers, Gillie and Marc Schattner of Australia have become the city’s most prolific creators of public art."
2019-02-08T10:00:00+0000,Readers respond to recent issues of the Sunday Book Review.
2019-03-01T23:09:27+0000,"Brands are giving lucrative endorsement deals to young children on YouTube and Instagram, raising questions about whether their young followers should be seeing that kind of marketing."
2019-01-20T05:10:00+0000,They met at a young professionals social after a church service.
2019-02-06T01:51:18+0000,"Corrections appearing in print on Wednesday, February 6, 2019."
2019-02-05T20:02:39+0000,Readers discuss the wearing of fur by black women.
2019-03-01T20:51:03+0000,The doyenne of domesticity will advise a Canadian company on a new line of hemp-based CBD products for animals and humans.
2019-01-12T11:00:01+0000,"The tawdry divorce of Libbie and David Mugrabi is not just a tabloid story. At stake are a trophy townhouse, works by Andy Warhol and Jeff Koons, and the inner workings of one of the world’s most influential art dealer families. "
2019-03-01T16:36:27+0000,"New research documents the far-reaching effects of the cash bail system, which disproportionately hurts the poor and African-Americans."
2019-03-01T22:16:13+0000,"Idealism can eventually bow to financial pressure and artificial intelligence companies, big and small, can change course."
2019-03-01T21:18:03+0000,"The Snap chief said that he was “impressed” by Europe’s moves, and that there was still time to “course-correct” in the United States."
2019-03-01T13:00:08+0000,"They range from an elephant figurine to a portrait of a slave ancestor. Maybe your desk has an oddly powerful item, too."
2019-03-01T19:45:34+0000,The airline said its employees were wrongly grounding planes to increase their leverage in a protracted contract negotiation.
2019-01-29T19:14:42+0000,Democratic lawmakers raised concerns about the Treasury secretary after a sanctions-lifting agreement benefited a big Republican donor.
2019-03-01T13:00:08+0000,"They range from an elephant figurine to a portrait of a slave ancestor. Maybe your desk has an oddly powerful item, too."
2019-02-28T22:38:23+0000,"The departure of the “Game of Thrones”-era chief executive, Richard Plepler, comes after AT&T acquired Time Warner, the network’s former corporate home."
2019-02-27T23:41:48+0000,Argosy University teetered on the edge of collapse after the federal government accused it of misusing money that was owed to students.
2019-02-28T22:18:09+0000,The lower-priced offering comes as sales appear to slow and follows a reduction in the federal tax credit for the company’s electric vehicles.
2019-02-27T20:50:12+0000,Robotics on display at MWC.
2019-01-28T21:45:49+0000,"The Justice Department unveiled sweeping charges against Huawei and its chief financial officer, Meng Wanzhou, who was arrested last year in Canada."
2019-01-11T18:44:20+0000,"The actor, considered a potential Oscar contender for his performance as a flawed but loving father, says, “We don’t see enough of those men and they do exist.”"
2019-02-28T12:00:04+0000,"Million-dollar-plus autos are selling less often at auction, at the slowest pace since 2008, when the car insurer Hagerty started tracking this data."
2019-01-30T11:00:05+0000,"It often comes with a steep asking price, but the military has played a critical role in establishing democracy in many countries."
2019-02-27T19:44:40+0000,The Associated Press and the White House Correspondents’ Association denounced the restriction on journalists’ access to a meeting between the president and North Korea’s autocratic leader.
2019-02-27T18:14:35+0000,"Departing from the industry’s longtime opposition, the automaker endorsed a mandate for vehicles to have alerts and precautions to address the hazard."
2019-01-29T20:17:20+0000,"A former executive at a logistics company delivered explosive testimony about corruption inside the African National Congress, South Africa’s governing party."
2019-02-23T16:33:22+0000,Konstantin V. Kilimnik is central to two of the most tantalizing elements in the special counsel’s investigation of possible collusion between the Trump campaign and Russia.
2019-01-14T17:34:10+0000,"A member of the Belgian Parliament discusses a law he sponsored to prevent slaughter without stunning, and the Good Food Institute writes about growing meat from cells."
